{
  "item": {
    "index": 2,
    "item": {
      "name": "Harbor Freightworks",
      "domain": "harbor-freightworks.example"
    },
    "item_key": "domain:harbor-freightworks.example",
    "query": "Harbor Freightworks"
  },
  "target_roles": [
    "VP Sales",
    "Head of Revenue Operations"
  ],
  "include_contact_details": true,
  "now": "2026-10-20T09:00:00Z"
}
